{
  "schema_version": "1.0.0",
  "event_id": "88888888-8888-4888-8888-888888888888",
  "timestamp": "2026-04-14T10:00:01Z",
  "event_type": "runtime.tool.executed",
  "severity": "info",
  "source": {
    "component": "executor",
    "host": "local-machine",
    "pid": 4120,
    "version": "1.0.0"
  },
  "run_context": {
    "run_id": "22222222-2222-4222-8222-222222222222",
    "request_id": "11111111-1111-4111-8111-111111111111",
    "phase_id": "1",
    "task_id": "P1-T1"
  },
  "payload": {
    "tool": "terminal",
    "action": "run_command",
    "status": "success",
    "duration_ms": 820
  },
  "policy_decision": {
    "decision": "allow",
    "risk_tier": "low",
    "rule_id": "policy.local.readonly",
    "reason": "Allowed read-only command",
    "evaluated_at": "2026-04-14T10:00:00Z"
  },
  "trace": {
    "trace_id": "aaaaaaaaaaaaaaaaaaaaaaaaaaaaaaaa",
    "span_id": "eeeeeeeeeeeeeeee",
    "parent_span_id": "bbbbbbbbbbbbbbbb",
    "correlation_id": "44444444-4444-4444-8444-444444444444"
  },
  "integrity": {
    "chain_id": "99999999-9999-4999-8999-999999999999",
    "event_hash": "bbbbbbbbbbbbbbbbbbbbbbbbbbbbbbbbbbbbbbbbbbbbbbbbbbbbbbbbbbbbbbbb",
    "prev_event_hash": "aaaaaaaaaaaaaaaaaaaaaaaaaaaaaaaaaaaaaaaaaaaaaaaaaaaaaaaaaaaaaaaa"
  },
  "tags": [
    "runtime",
    "tool",
    "phase-1"
  ]
}
